{
  "mathematical_progress" : "[unresolved] No mathematical research was executed or assessed. No primary-source lemma was pinned, no dependency map or planted-fault audit was produced, and no mathematical claim reached the admission gate.",
  "process_quality" : "The manager correctly withheld all briefs because the goal was inactive and lacked the required source, named lemma, edition, locator, and content hash. RUN.json records brief_count 0; consequently no builder or verifier results exist. The frozen exclusions against reconstruction from memory, novelty, prize progress, and re-solution were respected. The failed-to-launch disposition should be preserved. Verification still needed: explicit launch, lawful pinned source, completed audit artifacts, and an independent verifier disposition.",
  "polya_receipt" : {
    "advanced_first_open_line" : false,
    "removed_hypothesis" : false,
    "killed_route_class" : false,
    "side_theorem" : false,
    "explanation" : "The first open line—selecting and pinning the primary-source lemma and page/hash—remains open. No hypothesis or predeclared route class was tested, and no independently checkable theorem was produced. A renamed successor abstraction is not authorized."
  },
  "engine_assessment" : "Engine quality was safety-correct but operationally inefficient. It preserved the bounded goal, refused unauthorized source substitution, created no builder work, and made no admission. However, the no-brief outcome still consumed manager, memory, and review invocations, while verifier absence is represented only implicitly by missing branch artifacts rather than an explicit terminal disposition.",
  "engine_changes" : [ {
    "path" : "launch preflight / goal eligibility validation",
    "hypothesis" : "Rejecting inactive goals and source-dependent goals missing mandatory pins before model invocation will preserve the same safety outcome with less compute and clearer operator feedback.",
    "evidence" : "snapshot/goal.md marks the goal inactive and requires a maintainer-supplied source; manager/result.json reports all source-pin fields missing; RUN.json nevertheless records three invocations.",
    "predicted_benefit" : "Fail-fast launch behavior, fewer wasted invocations, and a deterministic failed-to-launch record.",
    "regression_risk" : "An overly broad rule could block exploratory goals where source selection is intentionally part of authorized work.",
    "cheapest_test" : "Add a fixture asserting that this inactive unpinned goal terminates before manager invocation, while an active goal with an attached source, named lemma, edition, locator, and hash proceeds."
  }, {
    "path" : "run manifest / no-brief terminal disposition",
    "hypothesis" : "An explicit disposition such as no-brief with builder_status and verifier_status fields will make absence distinguishable from missing, crashed, or incomplete artifacts.",
    "evidence" : "RUN.json reports brief_count 0 and the branch list is empty, but closeout must infer that no builder or verifier should exist by inspecting directories and manager/result.json.",
    "predicted_benefit" : "More reliable closeout automation, simpler audits, and fewer false interpretations of missing verifier output.",
    "regression_risk" : "A schema change may break consumers expecting format_version 1 or treating missing fields as the only no-branch signal.",
    "cheapest_test" : "Replay this run and one ordinary built-and-verified fixture against an additive schema change; confirm existing readers still parse both and the reviewer can classify each without directory inference."
  } ]
}
